{
  "key": "clothes-clandestine-champion",
  "name": "Clothes, Clandestine (Champion)",
  "sourceKey": "wh",
  "contentSet": "core",
  "itemType": "adventuringGear",
  "rarity": "artifact",
  "requiresAttunement": false,
  "subtype": "body",
  "description": "These clothes come with nine hidden pockets, each of which can store up to 1 lb. Finding these hidden pockets requires a DC 30 Investigation check."
}
