{
  "key": "handwraps-chassis-prototype",
  "name": "Handwraps Chassis (Prototype)",
  "sourceKey": "wh",
  "contentSet": "core",
  "itemType": "adventuringGear",
  "rarity": "prototype",
  "requiresAttunement": true,
  "subtype": "hands",
  "description": "_**Requires attunement**_\nThese modifiable handwraps chassis comes with vacant modification slots for vibroweapon modifications, as well as one augment slot. They can house modifications of prototype rarity or lower."
}
