{
  "key": "barbed-armoring",
  "name": "Barbed Armoring",
  "sourceKey": "wh",
  "contentSet": "core",
  "itemType": "itemModification",
  "rarity": "premium",
  "requiresAttunement": false,
  "subtype": "armor",
  "prerequisite": "Armor",
  "description": "This armor gains the barbed (1d4) property. If it already has the barbed property, the barbed damage increases by one step (from d4 to d6, or from d6 to d8)."
}
