{
  "key": "rending-conductor-mastery",
  "name": "Rending Conductor (Mastery)",
  "sourceKey": "wh",
  "contentSet": "core",
  "itemType": "itemModification",
  "rarity": "advanced",
  "requiresAttunement": false,
  "subtype": "focus generator",
  "description": "This item gains the rending 2 property. If it already has the rending property, its rending number increases by 2, to a maximum of 3."
}
