{
  "key": "flechette-clip-plasma-devastating",
  "name": "Flechette Clip, Plasma (Devastating)",
  "sourceKey": "ec",
  "contentSet": "expanded-content",
  "itemType": "consumable",
  "rarity": "artifact",
  "requiresAttunement": false,
  "subtype": "ammunition",
  "description": "When triggered, this enhanced wrist launcher ammunition fires a volley of energy flechette rounds in a short line 15 feet long and 5 feet wide or a long line 45 feet long and 5 feet wide. A single flechette clip holds enough ammunition for three attacks in a short line or one attack in a long line. Each creature must make a DC 24 Dexterity saving throw. A creature takes 6d10 energy damage on a failed save, or half as much as on a successful one. If you lack proficiency in the wrist launcher, you must roll the damage dice twice and take the lesser total."
}
