{
  "key": "rendcasting-channel-fighting",
  "name": "Rendcasting Channel (Fighting)",
  "sourceKey": "wh",
  "contentSet": "core",
  "itemType": "itemModification",
  "rarity": "premium",
  "requiresAttunement": false,
  "subtype": "focus generator",
  "description": "While using this item as your focus, you gain a +1 bonus to the force save DC of powers that require a Dexterity or Intelligence saving throw."
}
