{
  "key": "dispelling-emitter-improved",
  "name": "Dispelling Emitter (Improved)",
  "sourceKey": "wh",
  "contentSet": "core",
  "itemType": "itemModification",
  "rarity": "prototype",
  "requiresAttunement": false,
  "subtype": "focus generator",
  "description": "This item gains the dispelling 3 property. If it already has the dispelling property, its dispelling number increases by 3, to a maximum of 6."
}
