{
  "key": "torpedo-fragmentation-average",
  "name": "Torpedo, Fragmentation (Average)",
  "sourceKey": "ec",
  "contentSet": "expanded-content",
  "itemType": "consumable",
  "rarity": "premium",
  "requiresAttunement": false,
  "subtype": "ammunition",
  "description": "You have a +1 bonus to attack rolls made with this enhanced torpedo launcher ammunition, which deals 20d6 kinetic damage on a hit. This bonus is in addition to any bonuses granted by the weapon. Once the torpedo is depleted, it no longer gives a bonus."
}
