{
  "key": "grenade-gas-deadly",
  "name": "Grenade, Gas (Deadly)",
  "sourceKey": "ec",
  "contentSet": "expanded-content",
  "itemType": "consumable",
  "rarity": "advanced",
  "requiresAttunement": false,
  "subtype": "explosive",
  "description": "Grenades can be set to detonate on impact or with a timer that causes them to explode on initiative count 20 (losing all initiative ties). As an action, you can prime and throw a grenade at a point you can see within 30 feet + your Strength modifier x 5. The grenade explodes, filling the air in a 10-foot-radius sphere with yellow-green fog for 1 minute. The fog spreads around corners, and its area is heavily obscured. It lasts for 1 minute or until a wind of at least 10 miles per hour disperses it.\n\nWhen a creature enters the fog or starts its turn there, it creature must make a DC 20 Constitution saving throw. The creature takes 8d6 poison damage on a failed save, or half as much damage on a successful one. Additionally, on a failed save, the creature is poisoned while it is in the cloud. Droids, constructs and humanoids wearing appropriate protective equipment are unaffected."
}
